{
  "job_id": "f8a11fb1-7e1b-4e35-b968-67f0f7e58d40",
  "job_title": "Big Data Architect",
  "company": "Placeholder Company",
  "location": "Remote",
  "employment_type": "Full-time",
  "summary": "The Big Data Architect designs and implements enterprise-scale big data solutions, ensuring efficient data storage, processing, and analytics across distributed systems.",
  "responsibilities": [
    "Design architecture for big data platforms, pipelines, and lakes",
    "Evaluate and select big data technologies (Hadoop, Spark, Kafka, Flink)",
    "Optimize data workflows for scalability, performance, and reliability",
    "Ensure integration of structured, semi-structured, and unstructured data",
    "Collaborate with engineering, analytics, and business teams",
    "Define data security, governance, and compliance standards"
  ],
  "requirements": {
    "years_of_experience": {
      "min": 8,
      "max": 12
    },
    "education": [
      "Bachelor\u2019s or Master\u2019s degree in Computer Science, Engineering, or related field",
      "8\u201312 years of experience in big data engineering and architecture"
    ]
  },
  "skills_required": [
    {
      "name": "Deep expertise in big data frameworks and distributed systems"
    },
    {
      "name": "Strong programming and data modeling skills"
    },
    {
      "name": "Cloud platforms (AWS, Azure, GCP) and data lakes/warehouses"
    },
    {
      "name": "System design, scalability, and performance optimization"
    }
  ],
  "skills_preferred": [],
  "benefits": [],
  "metadata": {}
}